{
  "schema_version": "1.0",
  "fixture_id": "synthetic-gold-copy-rejection-v1",
  "gold_parts": {
    "[Content_Types].xml": "PD94bWwgdmVyc2lvbj0iMS4wIiBlbmNvZGluZz0iVVRGLTgiPz48VHlwZXMgeG1sbnM9Imh0dHA6Ly9zY2hlbWFzLm9wZW54bWxmb3JtYXRzLm9yZy9wYWNrYWdlLzIwMDYvY29udGVudC10eXBlcyI+PERlZmF1bHQgRXh0ZW5zaW9uPSJyZWxzIiBDb250ZW50VHlwZT0iYXBwbGljYXRpb24vdm5kLm9wZW54bWxmb3JtYXRzLXBhY2thZ2UucmVsYXRpb25zaGlwcyt4bWwiLz48T3ZlcnJpZGUgUGFydE5hbWU9Ii9kb2NQcm9wcy9jb3JlLnhtbCIgQ29udGVudFR5cGU9ImFwcGxpY2F0aW9uL3ZuZC5vcGVueG1sZm9ybWF0cy1wYWNrYWdlLmNvcmUtcHJvcGVydGllcyt4bWwiLz48T3ZlcnJpZGUgUGFydE5hbWU9Ii9wcHQvcHJlc2VudGF0aW9uLnhtbCIgQ29udGVudFR5cGU9ImFwcGxpY2F0aW9uL3ZuZC5vcGVueG1sZm9ybWF0cy1vZmZpY2Vkb2N1bWVudC5wcmVzZW50YXRpb25tbC5wcmVzZW50YXRpb24ubWFpbit4bWwiLz48L1R5cGVzPg==",
    "_rels/.rels": "PD94bWwgdmVyc2lvbj0iMS4wIiBlbmNvZGluZz0iVVRGLTgiPz48UmVsYXRpb25zaGlwcyB4bWxucz0iaHR0cDovL3NjaGVtYXMub3BlbnhtbGZvcm1hdHMub3JnL3BhY2thZ2UvMjAwNi9yZWxhdGlvbnNoaXBzIj48UmVsYXRpb25zaGlwIElkPSJySWQyIiBUeXBlPSJodHRwOi8vc2NoZW1hcy5vcGVueG1sZm9ybWF0cy5vcmcvcGFja2FnZS8yMDA2L3JlbGF0aW9uc2hpcHMvbWV0YWRhdGEvY29yZS1wcm9wZXJ0aWVzIiBUYXJnZXQ9ImRvY1Byb3BzL2NvcmUueG1sIi8+PFJlbGF0aW9uc2hpcCBJZD0icklkMSIgVHlwZT0iaHR0cDovL3NjaGVtYXMub3BlbnhtbGZvcm1hdHMub3JnL29mZmljZURvY3VtZW50LzIwMDYvcmVsYXRpb25zaGlwcy9vZmZpY2VEb2N1bWVudCIgVGFyZ2V0PSJwcHQvcHJlc2VudGF0aW9uLnhtbCIvPjwvUmVsYXRpb25zaGlwcz4=",
    "docProps/core.xml": "PD94bWwgdmVyc2lvbj0iMS4wIiBlbmNvZGluZz0iVVRGLTgiPz48Y3A6Y29yZVByb3BlcnRpZXMgeG1sbnM6Y3A9Imh0dHA6Ly9zY2hlbWFzLm9wZW54bWxmb3JtYXRzLm9yZy9wYWNrYWdlLzIwMDYvbWV0YWRhdGEvY29yZS1wcm9wZXJ0aWVzIiB4bWxuczpkY3Rlcm1zPSJodHRwOi8vcHVybC5vcmcvZGMvdGVybXMvIj48ZGN0ZXJtczpjcmVhdGVkPjIwMjYtMDctMThUMDA6MDA6MDBaPC9kY3Rlcm1zOmNyZWF0ZWQ+PGNwOnJldmlzaW9uPjE8L2NwOnJldmlzaW9uPjwvY3A6Y29yZVByb3BlcnRpZXM+",
    "ppt/presentation.xml": "PHA6cHJlc2VudGF0aW9uIHhtbG5zOnA9Imh0dHA6Ly9zY2hlbWFzLm9wZW54bWxmb3JtYXRzLm9yZy9wcmVzZW50YXRpb25tbC8yMDA2L21haW4iPjxwOnNsZElkTHN0Lz48L3A6cHJlc2VudGF0aW9uPg=="
  },
  "cases": [
    {
      "id": "exact-gold-bytes",
      "recipe": "exact_bytes",
      "expect_byte_match": true,
      "expect_package_match": true,
      "expected_decision": "gold_artifact_copy"
    },
    {
      "id": "repacked-gold",
      "recipe": "repacked",
      "expect_byte_match": false,
      "expect_package_match": true,
      "expected_decision": "gold_artifact_copy"
    },
    {
      "id": "volatile-metadata-only",
      "recipe": "volatile_core_changed",
      "expect_byte_match": false,
      "expect_package_match": true,
      "expected_decision": "gold_artifact_copy"
    },
    {
      "id": "nonvolatile-content-change",
      "recipe": "content_changed",
      "expect_byte_match": false,
      "expect_package_match": false,
      "expected_decision": "not_a_gold_copy"
    }
  ],
  "expected_canonical_sha256": "2af1ca72d58ae9e851048966c54cfcf49fbee5f0f08e487b75af0ae980a6ad23"
}
